{
  "video": {
    "title": "Audio timing fixture",
    "subtitle": "Two mapped scenes",
    "format": "vertical_9_16",
    "width": 1080,
    "height": 1920,
    "fps": 30,
    "durationSec": 6,
    "style": "fixture",
    "language": "vi"
  },
  "theme": {
    "name": "fixture",
    "accent": "#ffffff",
    "accentSoft": "#cccccc",
    "background": "#000000",
    "foreground": "#ffffff",
    "muted": "#999999"
  },
  "assets": [],
  "scenes": [
    {
      "id": "scene-001",
      "intent": "hook",
      "templateId": "hero",
      "templateRole": "scene",
      "durationSec": 1.66,
      "segmentIds": [
        "seg-001"
      ],
      "headline": "Scene one",
      "subtitle": {
        "text": "First segment"
      },
      "content": {},
      "style": {
        "density": "low",
        "safeArea": "tiktok"
      },
      "motion": [],
      "layout": "center-stage",
      "reason": "Fixture scene",
      "startMs": 0,
      "endMs": 1660
    },
    {
      "id": "scene-002",
      "intent": "takeaway",
      "templateId": "end-card",
      "templateRole": "scene",
      "durationSec": 4.34,
      "segmentIds": [
        "seg-002",
        "seg-003"
      ],
      "headline": "Scene two",
      "subtitle": {
        "text": "Second segment"
      },
      "content": {},
      "style": {
        "density": "low",
        "safeArea": "tiktok"
      },
      "motion": [],
      "layout": "bottom-statement",
      "reason": "Fixture scene",
      "startMs": 2180,
      "endMs": 6520
    }
  ]
}
